{
  "id": "building.gatehouse.yard",
  "name": "Yard Gatehouse",
  "size": {
    "w": 8,
    "h": 6
  },
  "tiles": [
    1,
    1,
    1,
    2,
    1,
    1,
    1,
    1,
    1,
    0,
    0,
    0,
    0,
    0,
    0,
    1,
    1,
    0,
    0,
    0,
    0,
    4,
    0,
    1,
    2,
    0,
    0,
    0,
    0,
    0,
    0,
    1,
    1,
    0,
    0,
    0,
    0,
    0,
    0,
    1,
    1,
    1,
    1,
    0,
    1,
    1,
    1,
    1
  ],
  "surfaces": [
    0,
    0,
    0,
    0,
    0,
    0,
    0,
    0,
    0,
    0,
    0,
    0,
    0,
    0,
    0,
    0,
    0,
    0,
    0,
    0,
    0,
    0,
    0,
    0,
    0,
    0,
    0,
    0,
    0,
    0,
    0,
    0,
    0,
    0,
    0,
    0,
    0,
    0,
    0,
    0,
    0,
    0,
    0,
    0,
    0,
    0,
    0,
    0
  ],
  "indoors": [
    0,
    0,
    0,
    0,
    0,
    0,
    0,
    0,
    0,
    1,
    1,
    1,
    1,
    1,
    1,
    0,
    0,
    1,
    1,
    1,
    1,
    1,
    1,
    0,
    0,
    1,
    1,
    1,
    1,
    1,
    1,
    0,
    0,
    1,
    1,
    1,
    1,
    1,
    1,
    0,
    0,
    0,
    0,
    0,
    0,
    0,
    0,
    0
  ],
  "doors": [
    {
      "x": 3,
      "y": 5
    }
  ],
  "tags": [
    "industrial",
    "shed"
  ],
  "weight": 4,
  "look": {
    "roof": "tin",
    "wall": "plaster"
  }
}
