{
  "id": "building.kiosk.corner",
  "name": "Corner Kiosk",
  "size": {"w": 8, "h": 7},
  "tiles": [1, 2, 2, 1, 1, 2, 2, 1, 1, 0, 0, 0, 0, 0, 0, 1, 1, 0, 4, 4, 4, 4, 0, 1, 2, 0, 0, 0, 0, 0, 0, 2, 1, 0, 3, 0, 0, 3, 0, 1, 1, 0, 0, 0, 0, 0, 0, 1, 1, 1, 0, 0, 1, 1, 1, 1],
  "surfaces": [0, 0, 0, 0, 0, 0, 0, 0, 0, 0, 0, 0, 0, 0, 0, 0, 0, 0, 0, 0, 0, 0, 0, 0, 0, 0, 0, 0, 0, 0, 0, 0, 0, 0, 0, 0, 0, 0, 0, 0, 0, 0, 0, 0, 0, 0, 0, 0, 0, 0, 0, 0, 0, 0, 0, 0],
  "indoors": [0, 0, 0, 0, 0, 0, 0, 0, 0, 1, 1, 1, 1, 1, 1, 0, 0, 1, 1, 1, 1, 1, 1, 0, 0, 1, 1, 1, 1, 1, 1, 0, 0, 1, 1, 1, 1, 1, 1, 0, 0, 1, 1, 1, 1, 1, 1, 0, 0, 0, 0, 0, 0, 0, 0, 0],
  "doors": [{"x": 2, "y": 6}, {"x": 3, "y": 6}],
  "tags": ["commercial"],
  "weight": 5,
  "look": {"roof": "tar", "wall": "plaster"}
}
