{
  "id": "building.shed.garage",
  "name": "Single Garage",
  "size": {"w": 7, "h": 5},
  "tiles": [1, 2, 1, 1, 1, 2, 1, 1, 0, 0, 0, 0, 0, 1, 1, 0, 0, 0, 0, 0, 1, 1, 0, 0, 0, 0, 0, 1, 1, 0, 0, 0, 0, 0, 1],
  "surfaces": [0, 0, 0, 0, 0, 0, 0, 0, 0, 0, 0, 0, 0, 0, 0, 0, 0, 0, 0, 0, 0, 0, 0, 0, 0, 0, 0, 0, 0, 0, 0, 0, 0, 0, 0],
  "indoors": [0, 0, 0, 0, 0, 0, 0, 0, 1, 1, 1, 1, 1, 0, 0, 1, 1, 1, 1, 1, 0, 0, 1, 1, 1, 1, 1, 0, 0, 0, 0, 0, 0, 0, 0],
  "doors": [{"x": 1, "y": 4}, {"x": 2, "y": 4}, {"x": 3, "y": 4}, {"x": 4, "y": 4}, {"x": 5, "y": 4}],
  "tags": ["shed"],
  "weight": 8,
  "dormant": {"chance": 0.35, "max": 1},
  "look": {"roof": "tin", "wall": "plaster"}
}
